{
  "$schema": "../../governance.schema.json",
  "modulo": "service-orders",
  "displayName": "Service Orders (Ordens de Servi\u00e7o)",
  "owner": "Gladiston-Porto",
  "statusAtual": "Needs Re-audit",
  "ultimaAuditoria": null,
  "proximaAuditoriaObrigatoria": "2026-06-15",
  "intervaloMaxDias": 30,
  "criteriosDeAprovacao": {
    "P1Abertos": 0,
    "P2Abertos": 0,
    "regressionTestCoverage": "todos os bugs FIXED devem ter @bug:ID",
    "semgrepFindings": 0,
    "healthCheckPassing": true
  },
  "bugs": {
    "referencia": "relatorios/known-bugs.json",
    "abertos": [],
    "corrigidos": []
  },
  "expira": {
    "data": "2026-06-15",
    "acao": "re-audit obrigat\u00f3rio",
    "aviso30dias": true
  },
  "notas": "M\u00f3dulo cr\u00edtico de opera\u00e7\u00e3o di\u00e1ria. M\u00e1quina de estados complexa. Skill: service-order-module/PLAYBOOK.md."
}