{
  "$schema": "../../governance.schema.json",
  "modulo": "rh",
  "displayName": "RH / Workforce",
  "owner": "Gladiston-Porto",
  "statusAtual": "Needs Re-audit",
  "ultimaAuditoria": null,
  "proximaAuditoriaObrigatoria": "2026-07-01",
  "intervaloMaxDias": 30,
  "criteriosDeAprovacao": {
    "P1Abertos": 0,
    "P2Abertos": 0,
    "regressionTestCoverage": "todos os bugs FIXED devem ter @bug:ID",
    "semgrepFindings": 0,
    "healthCheckPassing": true
  },
  "bugs": {
    "referencia": "relatorios/known-bugs.json",
    "abertos": [],
    "corrigidos": []
  },
  "expira": {
    "data": "2026-07-01",
    "acao": "re-audit obrigat\u00f3rio",
    "aviso30dias": true
  },
  "notas": "Inclui RH (src/app/rh/) e Workforce. Owner compensation LLC/S-Corp. Dados sens\u00edveis de SSN/EIN."
}